<?xml version="1.0" encoding="UTF-8"?>
<tns:modelica xmlns:tns="http://www.pymoca.com/Pymoca" xmlns:xsi="http://www.w3.org/2001/XMLSchema-instance" xsi:schemaLocation="http://www.pymoca.com/Pymoca Pymoca.xsd ">
  <class encapsulated="true">
    <components visibility="public">
      <declare type="Real" causality="input">
        <variable name="x">
          <shape>
            <int>2</int>
            <int>2</int>
          </shape>
          <modifier/>
        </variable>
        <variable name="y"/>
      </declare>
      <declare type="Real" variability="parameter">
        <variable name="c">
          <shape>
            <int>2</int>
            <int>1</int>
          </shape>
          <modifier/>
        </variable>
      </declare>
    </components>
    <equations initial="true">
        </equations>
    <equations>
      <equal>
        <ref name="Some">
          <add>
            <int>1</int>
            <int>1</int>
          </add>
          <ref name="x"/>
          <slice/>
          <subref name="Stuff">
            <int>1</int>
            <slice/>
          </subref>
        </ref>
        <neg>
          <mul>
            <neg>
              <int>12</int>
            </neg>
            <int>12</int>
          </mul>
        </neg>
      </equal>
    </equations>
    <algorithms initial="true">
      <assign>
        <ref name="x"/>
        <ref name="y"/>
      </assign>
    </algorithms>
    <algorithms>
      <assign>
        <ref name="x"/>
        <ref name="y"/>
      </assign>
    </algorithms>
  </class>
</tns:modelica>
<!-- vim: set et fenc=utf-8 ff=unix sts=0 sw=4 ts=4 : -->
